language	page_url	image_url	page_title	section_title	hierarchical_section_title	caption_reference_description	caption_attribution_description	caption_alt_text_description	mime_type	original_height	original_width	is_main_image	attribution_passes_lang_id	page_changed_recently	context_page_description	context_section_description	index	image_path	Index
en	https://en.wikipedia.org/wiki/Cloture	https://upload.wikimedia.org/wikipedia/commons/f/f6/US_Senate_cloture_since_1917.png	Cloture	Procedure	Cloture / United States / Procedure	Cloture voting in the United States Senate , 1917−2014.[43]	English: Number of cloture motions filed, voted on, and invoked by the U.S. Senate since 1917. Data from http://www.senate.gov/pagelayout/reference/cloture_motions/clotureCounts.htm See earlier graph: https://commons.wikimedia.org/wiki/File:Cloture_Voting,_United_States_Senate,_1947_to_2008.svg	Number of cloture motions filed, voted on, and invoked by the U.S. Senate, 1917−2014.	image/png	1946	2846	False	True	False	"Cloture, closure or, informally, a guillotine, is a motion or process in parliamentary procedure aimed at bringing debate to a quick end. The cloture procedure originated in the French National Assembly, from which the name is taken. Clôture is French for ""the act of terminating something"". It was introduced into the Parliament of the United Kingdom by William Ewart Gladstone to overcome the obstructionism of the Irish Parliamentary Party and was made permanent in 1887. It was subsequently adopted by the United States Senate and other legislatures. The name cloture remains in the United States; in Commonwealth countries it is usually closure or, informally, guillotine; in the United Kingdom closure and guillotine are distinct motions."	"The three-fifths version of the cloture rule does not apply to motions to end filibusters relating to Senate Rule changes. To invoke cloture to end debate over changing the Senate rules, the original version of the rule (two-thirds of those Senators ""present and voting"") still applies.
The procedure for ""invoking cloture"", or ending a filibuster, is as follows:
A minimum of 16 senators must sign a petition for cloture.
The petition may be presented by interrupting another Senator's speech.
The clerk reads the petition.
The cloture petition is ignored for one full day during which the Senate is sitting (called a ""Legislative Day""). For example, if the petition is filed on Monday, it is ignored until Wednesday; if the petition is filed on a Friday, it is ignored until Tuesday, assuming that the Senate did not sit on Saturday or Sunday.
On the second Legislative Day after the presentation of the petition, after the Senate has been sitting for one hour, a ""quorum call"" is undertaken to ensure a majority of the Senators are present. However, the mandatory quorum call is often waived by unanimous consent.
The Majority Leader presents the petition.
The Senate votes on the petition; three-fifths of the whole number of Senators (sixty if there are no vacancies) is the required majority; however, when cloture is invoked on a question of changing the rules of the Senate, two-thirds of the Senators voting (not necessarily two-thirds of all Senators) is the requisite majority. This is commonly referred to as a ""test vote"".
Cloture on a presidential nomination requires a simple majority of those present and voting. This was changed for all presidential appointments other than Supreme Court nominees in a 21 November 2013 Senate vote (the so-called ""nuclear option""), and was further extended to include Supreme Court nominees in an 6 April 2017 Senate vote.
After cloture has been invoked, the following restrictions apply:
No more than 30 additional hours of debate may occur on the bill in question (though this additional time is commonly shortened or vitiated altogether; in addition, since the nuclear option of April 2019, nominations to subcabinet executive branch, or district court, positions normally mandate only 2 additional hours).
No Senator may speak for more than one hour.
No amendments may be moved unless they were filed on the day between the presentation of the petition and the actual cloture vote.
All amendments must be relevant to the debate.
Certain procedural motions are not permissible. Senate Rule XXII provides that no dilatory motion or amendment is in order under cloture. While there is no exact list of what motions are dilatory, ""Motions to adjourn, postpone, recess, suspend the rules, and reconsider have been held to be dilatory. There also is precedent supporting the authority of the presiding officer to rule that a quorum call is dilatory under these circumstances.""
The presiding officer gains additional powers in controlling debate such as the power to count to determine whether a quorum is present and to rule amendments, motions, and other actions out of order on the grounds that they are dilatory.
No other matters may be considered until the question upon which cloture was invoked is resolved."	76637.0	train-0-76637.png	76637
en	https://en.wikipedia.org/wiki/Saqqaq	https://upload.wikimedia.org/wikipedia/commons/8/85/Saqqaq-population-dynamics.png	Saqqaq	Population	Saqqaq / Population	Saqqaq population growth dynamics in the last two decades. Source: Statistics Greenland[8]	Population growth dynamics in Saqqaq, Greenland. Numbers from 1991-2010 from Statistics Greenland. (http://bank2.stat.gl/) The graph is own work.	Saqqaq population dynamics	image/png	250	1000	False	True	True	"Saqqaq is a settlement in the Avannaata municipality in western Greenland. Founded in 1755 as Solsiden, Saqqaq had 132 inhabitants in 2020. The village's Kalaallisut name is a translation of the Danish meaning ""Sunny Side"", in reference to its position relative to Livets Top.
It is the site name for the Saqqaq culture."	The population of Saqqaq has increased by 60 percent relative to the 1990 levels, stabilizing in the following decade. Saqqaq is one of the very few demographically stable settlements in the Disko Bay region.	89137.0	train-0-89137.png	89137
en	https://en.wikipedia.org/wiki/Great_Southern_Group	http://upload.wikimedia.org/wikipedia/commons/9/90/Great_Southern_Group_assets_1999-2008.jpg	Great Southern Group	Fall	Great Southern Group / Fall	"Great Southern Group's assets. Net assets were ultimately limited by the company's ""unsustainable levels"" of debt.[4]"	English: Graph showing Great Southern Group total and net assets from shortly after listing as a public company, to last annual report	area graph with years on the x-axis, ranging from 1999 to 2008, and thousands of dollars on the y-axis. Two areas are shown: net assets climb until 2005 then stay at a similar level to 2008, below the 800 million dollar line; gross assets climb above net assets and are still increasing in 2008, where they are near the 1.8 billion dollar line	image/jpeg	319	394	False	True	False	"Great Southern Group was a group of Australian companies that was notable as the country's largest agribusiness managed investment scheme business.
The company was founded in 1987 and became a public company in 1999. It expanded its MIS business rapidly in the 2000s, supported by favourable tax regulations for these types of investments. Most of the Group's business was in plantation forestry to supply woodchips for the pulp and paper industry, but in the 2000s it diversified into high-value timbers, beef cattle, olives, viticulture, and almond production. The company's after-tax profit peaked at A$132 million in 2006, but by 2008 had deteriorated to a A$63 million loss.
The Great Southern companies attracted debate and criticism associated with the operation of managed investment schemes generally, and the environmental performance of their Tiwi Islands operation in particular. On 16 May 2009, as a result of worsening economic conditions and regulatory issues, the GSL, GSMAL, GSF and other subsidiaries of GSL entered into voluntary administration. Ferrier Hodgson was assigned as liquidator of Great Southern Group."	"In the mid-2000s, Great Southern's business was growing rapidly, with sales and market capitalisation increasing at more than 100 per cent per annum. However, in its 2005 Annual Report, the company disclosed that it was subsidising the returns to its 1994 forestry scheme by approximately A$3 million, and that it expected to have to similarly subsidise the 1995 and 1996 schemes by up to A$12 million in future years. Board chairman Peter Patrikeos and non-executive director Jeffry Mews both expressed concern about the way in which Great Southern was funding shortfalls on the sales of timber products, with the issue leading directly to Mews' resignation. Although the company continued to sell over A$800 million of MIS products in the two financial years after incurring losses on its early offerings, it was not meeting sales targets, and its share price was falling.
Underpinning Great Southern's decision to subsidise returns to its early investors was a looming problem: its forestry plantations were not performing to expectations. Timber yields were poorer than had been projected. Great Southern's baseline projection had been 250 tonnes of woodchips per hectare, but an assessment in 2003 suggested that in most plantations yield would be reduced: in some cases to less than half the planned figure. The company itself considered that yields were proving to be ""disappointing"", with actual yields for the woodlots planted in the period between 1994 and 1997 (and thus harvested by 2008) being between 120 and 200 tonnes per hectare. Plantation growth had been limited by drought conditions and issues with the site and seedling quality of early plantings.
The company's sales of MIS schemes, and its profits, both peaked in 2006, with over A$450 million in sales, and a net profit after tax of A$133 million. However, the 2006 harvest (of 1996 plantations) yielded a return of only A$1500 and $1750 for the woodlots that investors had bought for A$3000. These plantations had not been productive enough to yield a profit for investors, so Great Southern inflated the returns to A$4100 using its own funds.
In December 2007 Young announced he would step down as managing director, remaining as both non-executive director and major shareholder. Saying that he wanted someone younger to implement the company's five-year business plans, he handed over to Cameron Rhodes, one of Great Southern's existing senior management team.
In 2008, Great Southern had over 430 employees managing investment schemes on behalf of over 47 000 investors. Industry sectors in which investment occurred included beef cattle, forestry, wine grapes, almonds, and poultry production. Its plantation estate had grown to 179 000 hectares, the vast majority of which was for wood pulp production.
As MIS sales declined from their 2006 peak, the Group's debt levels rose. By October 2008, business analysts Austock Securities were describing the company as ""excessively geared"". The Group developed a proposal, known as Project Transform, to restructure the business, in particular through seeking the agreement of investors to swap their MIS investments for shares in Great Southern Limited. The intention was to free up capital to reduce debt, and make the business more attractive to investors. Analysts such as Austock Securities and Macquarie Research Equities supported the strategy.
The company reported a A$64 million loss in its 2008 financial year. By 2009, the global economic downturn, and regulatory uncertainty associated with MIS schemes, was putting the company under financial pressure, and it was seeking to improve its situation both through asset sales and refinancing of debt. Its debt levels had risen significantly: it had extended its debt financing with its banks from A$245 million to A$350 million in 2007. By September 2008 its total debt had ballooned to A$820 million, of which A$376 million was owed to its lead bankers, ANZ, Commonwealth Bank, BankWest and Mizuho. Great Southern had also been hoping to see a rise in the price obtained for its woodchips, but was unsuccessful "	105181.0	train-0-105181.jpg	105181
en	https://en.wikipedia.org/wiki/Breastfeeding_promotion	https://upload.wikimedia.org/wikipedia/commons/f/fe/Breastfeeding_in_Asia.png	Breastfeeding promotion	India	Breastfeeding promotion / Breastfeeding promotion projects by region / Asia / India	Early Initiation of Breastfeeding in some of the Asian countries. Source: 2018 Global Breastfeeding Scorecard	English: Early Initiation of breastfeeding in Asia. Source: 2018 Global Breastfeeding Scorecard https://www.indiaspend.com/6-in-10-indian-babies-miss-out-on-early-breastfeeding-and-its-life-saving-benefits-62614/	Early Initiation of Breastfeeding in some of the Asian countries. Source: 2018 Global Breastfeeding Scorecard https://www.indiaspend.com/6-in-10-indian-babies-miss-out-on-early-breastfeeding-and-its-life-saving-benefits-62614/	image/png	395	638	False	True	True	"Breastfeeding promotion refers to coordinated activities and policies to promote health among women, newborns and infants through breastfeeding.
The World Health Organization recommends infants should be exclusively breastfed for the first six months of life to achieve optimal health and development, followed by complementary foods while continuing breastfeeding for up to two years or beyond. However, currently fewer than 40% of infants under six months of age are exclusively breastfed worldwide.
Public health awareness events such as World Breastfeeding Week, as well as training of health professionals and planning, aim to increase this number."	The Government of India initiated the nation-wide breastfeeding programme: MAA- Mother’s Absolute Affection, in August 2016. Initiation of breastfeeding within the first hour of birth and exclusive breastfeeding for at least six months are the two main goals of the MAA programme.	119573.0	train-0-119573.png	119573
en	https://en.wikipedia.org/wiki/InflateSail	https://upload.wikimedia.org/wikipedia/commons/0/02/InflateSail_August.jpg	InflateSail	Altitude loss	InflateSail / Altitude loss	Change in average orbit height during August 2017[11]	English: InflateSail Orbit Average Height for August 2017	Change in average orbit height during August 2017	image/jpeg	400	600	False	True	False	InflateSail was a 3U CubeSat launched on PSLV C38 on 23 June 2017 into a 505 km polar Sun-synchronous orbit. It carried a 1 m long inflatable rigidizable mast, and a 10 m² drag-deorbiting sail. Its primary aim was to demonstrate the effectiveness of drag based deorbiting from low Earth orbit. Built by Surrey Space Centre of the University of Surrey, it was one of the Technology Demonstrator CubeSats for the QB50 mission. An identical drag sail payload was planned to be included on the RemoveDEBRIS demonstrator.	InflateSail successfully deployed its sail approximately one hour after ejection from the launch vehicle and was the first European sail successfully deployed in space. InflateSail rapidly lost altitude and decayed on 3 September 2017 after 72 days in orbit.	183840.0	train-0-183840.jpg	183840
en	https://en.wikipedia.org/wiki/European_debt_crisis	https://upload.wikimedia.org/wikipedia/commons/4/4f/Portuguese_debt_and_EU_average.png	European debt crisis	Portugal	European debt crisis / Evolution of the crisis / Portugal	Debt of Portugal compared to eurozone average since 1999	"English: Portuguese debt history since 1999. 1999-2011: Eurostat data: http://epp.eurostat.ec.europa.eu/portal/page/portal/government_finance_statistics/data/main_tables (see ""General government gross debt"") (see also: epp.eurostat.ec.europa.eu/cache/ITY_PUBLIC/2-23042012-AP/DE/2-23042012-AP-DE.PDF) 2010-2015: Eurostat data: http://ec.europa.eu/economy_finance/publications/european_economy/2013/pdf/ee7_en.pdf (latest update: October 2013) 2016-2017: Once Ernst &amp; Young updates their forecasts, then we could use their data as well: 2015-2016 estimates from Ernst &amp; Young using data from Oxford Economics http://ey-charts.living-digital.com/view-chart?key=19&#160;; see also: http://www.ey.com/GL/en/Issues/Business-environment/EUROZONE-COUNTRY (latest update: June 2012)"	Portuguese debt compared to eurozone average	image/png	681	703	False	True	True	"The European debt crisis is a multi-year debt crisis that has been taking place in the European Union since the end of 2009. Several eurozone member states were unable to repay or refinance their government debt or to bail out over-indebted banks under their national supervision without the assistance of third parties like other eurozone countries, the European Central Bank, or the International Monetary Fund.
The eurozone crisis was caused by a balance-of-payments crisis. The crisis was worsened by the inability of states to resort to devaluation. Debt accumulation in some eurozone members was in part due to macroeconomic differences among eurozone member states prior to the adoption of the euro. The European Central Bank adopted an interest rate that incentivized investors in Northern eurozone members to lend to the South, whereas the South was incentivized to borrow. Over time, this led to the accumulation of deficits in the South, primarily by private economic actors. A lack of fiscal policy coordination among eurozone member states contributed to imbalanced capital flows in the eurozone."	"Unlike other European countries that were also severely hit by the Great Recession in the late 2000s and eventually received bailouts in the early 2010s (such as Greece and Ireland), Portugal had the characteristic that the 2000s were not marked by economic growth, but were already a period of economic crisis, marked by stagnation, two recessions (in 2002–03 and 2008–09) and government-sponsored fiscal austerity in order to reduce the budget deficit to the limits allowed by the European Union's Stability and Growth Pact.
According to a report by the Diário de Notícias, Portugal had allowed considerable slippage in state-managed public works and inflated top management and head officer bonuses and wages in the period between the Carnation Revolution in 1974 and 2010. Persistent and lasting recruitment policies boosted the number of redundant public servants. Risky credit, public debt creation, and European structural and cohesion funds were mismanaged across almost four decades. When the global crisis disrupted the markets and the world economy, together with the US subprime mortgage crisis and the eurozone crisis, Portugal was one of the first economies to succumb, and was affected very deeply.
In the summer of 2010, Moody's Investors Service cut Portugal's sovereign bond rating, which led to an increased pressure on Portuguese government bonds. In the first half of 2011, Portugal requested a €78 billion IMF-EU bailout package in a bid to stabilise its public finances.
Portugal's debt was in September 2012 forecast by the Troika to peak at around 124% of GDP in 2014, followed by a firm downward trajectory after 2014. Previously the Troika had predicted it would peak at 118.5% of GDP in 2013, so the developments proved to be a bit worse than first anticipated, but the situation was described as fully sustainable and progressing well. As a result, from the slightly worse economic circumstances, the country has been given one more year to reduce the budget deficit to a level below 3% of GDP, moving the target year from 2013 to 2014. The budget deficit for 2012 has been forecast to end at 5%. The recession in the economy is now also projected to last until 2013, with GDP declining 3% in 2012 and 1% in 2013; followed by a return to positive real growth in 2014. Unemployment rate increased to over 17% by end of 2012 but it has since decreased gradually to 10,5% as of November 2016.
As part of the bailout programme, Portugal was required to regain complete access to financial markets by September 2013. The first step towards this target was successfully taken on 3 October 2012, when the country managed to regain partial market access by selling a bond series with 3-year maturity. Once Portugal regains complete market access, measured as the moment it successfully manage to sell a bond series with a full 10-year maturity, it is expected to benefit from interventions by the ECB, which announced readiness to implement extended support in the form of some yield-lowering bond purchases (OMTs), aiming to bring governmental interest rates down to sustainable levels. A peak for the Portuguese 10-year governmental interest rates happened on 30 January 2012, where it reached 17.3% after the rating agencies had cut the governments credit rating to ""non-investment grade"" (also referred to as ""junk""). As of December 2012, it has been more than halved to only 7%. A successful return to the long-term lending market was made by the issuing of a 5-year maturity bond series in January 2013, and the state regained complete lending access when it successfully issued a 10-year maturity bond series on 7 May 2013.
According to the Financial Times special report on the future of the European Union, the Portuguese government has ""made progress in reforming labour legislation, cutting previously generous redundancy payments by more than half and freeing smaller employers from collective bargaining obligations, all components of Portugal's €78 billion bailout program"". Additionally, unit labour costs have fallen since 2009, working practices are liberali"	191651.0	train-0-191651.png	191651
en	https://en.wikipedia.org/wiki/Near-infrared_window_in_biological_tissue	https://upload.wikimedia.org/wikipedia/commons/2/2a/Molar_extinction_coefficients_of_eumelanin_and_pheomelanin.png	Near-infrared window in biological tissue	Water	Near-infrared window in biological tissue / Absorption properties of tissue components / Water	Figure 3: The molar extinction coefficients of eumelanin and pheomelanin.[5]	English: Figure 3: The molar extinction coefficients of eumelanin and pheomelanin.	Figure 3: Figure 3: The molar extinction coefficients of eumelanin and pheomelanin.	image/png	721	987	False	True	False	The near-infrared window defines the range of wavelengths from 650 to 1350 nanometre where light has its maximum depth of penetration in tissue. Within the NIR window, scattering is the most dominant light-tissue interaction, and therefore the propagating light becomes diffused rapidly. Since scattering increases the distance travelled by photons within tissue, the probability of photon absorption also increases. Because scattering has weak dependence on wavelength, the NIR window is primarily limited by the light absorption of blood at short wavelengths and water at long wavelengths. The technique using this window is called NIRS. Medical imaging techniques such as fluorescence image-guided surgery often make use of the NIR window to detect deep structures.	"Although water is nearly transparent in the range of visible light, it becomes absorbing over the near-infrared region. Water is a critical component since its concentration is high in human tissue. The absorption spectrum of water in the range from 250 to 1000 nm is shown in Figure 2. Although absorption is rather low in this spectral range, it still contributes to the overall attenuation of tissue.
 
Other tissue components with less significant contributions to the total absorption spectrum of tissue are melanin and fat."	201657.0	train-0-201657.png	201657
