language	page_url	image_url	page_title	section_title	hierarchical_section_title	caption_reference_description	caption_attribution_description	caption_alt_text_description	mime_type	original_height	original_width	is_main_image	attribution_passes_lang_id	page_changed_recently	context_page_description	context_section_description	index	image_path	Index
en	https://en.wikipedia.org/wiki/Safety_of_electronic_cigarettes	https://upload.wikimedia.org/wikipedia/commons/c/c3/E-Cigarette_fires_and_explosions_compared_to_sales_2009-2016.png	Safety of electronic cigarettes	Fires, explosions, and other battery-related malfunctions	Safety of electronic cigarettes / Fires, explosions, and other battery-related malfunctions	Graphic from a July 2016 United States Fire Administration (USFA) report entitled Electronic Cigarette Fires and Explosions in the United States 2009 – 2016.[326] There has been an increase in the number of severe and moderate injuries resulting from e-cigarette explosions and fires since 2014.[326] The USFA noted that this appears to correlate well with the e-cigarette sales trend.[326]	English: A line chart showing the number of e-cigarette fires and explosions versus e-cigarette sales in millions of US dollars.	Graphic from a July 2016 United States Fire Administration (USFA) report entitled Electronic Cigarette Fires and Explosions in the United States 2009 – 2016. There has been an increase in the number of severe and moderate injuries resulting from e-cigarette explosions and fires since 2014. The USFA noted that this appears to correlate well with the e-cigarette sales trend.	image/png	305	553	False	True	True	"The use of electronic cigarettes carries health risks compared to not using any inhaled recreational drugs, especially for children, young adults, and pregnant women. The risk depends on the composition of electronic cigarette aerosol, which varies according to the contents of the liquid, the physical and electrical design of the device, and user behavior. As of 2019, the long-term risks of vaping are somewhat uncertain because studies have yet to be performed on the relatively new technology, though the long-term risks of some individual substances in vaping aerosols and tobacco smoke have been studied.
When used to deliver nicotine, vaping avoids several carcinogens usually found in tobacco smoke produced by cigarettes and cigars, such as ash, tar, and carbon monoxide. E-cigarettes reduce lung function, reduce cardiac muscle function, and increase inflammation, but to a much lower extent than with traditional cigarettes. Some hazards occur with vaping but not with smoking."	"Most e-cigarettes use lithium batteries, the improper use of which may result in accidents. Most fires caused by vaporing devices are a result of the lithium batteries becoming too hot and igniting. Defective e-cigarette batteries have been known to cause fires and explosions. The chance of an e-cigarette blast resulting in burns and projectile harms greatly rises when using low-quality batteries, if stored incorrectly or was altered by the user. Inexpensive manufacturing with poor quality control could account for some of the explosions. It has been recommended that manufacturing quality standards be imposed in order to prevent such accidents. Better product design and standards could probably reduce some of the risks. It is recommended that users be informed of appropriate charging and storage methods. In the event the lithium ion substances leak from the battery as a result of an e-cigarette blast, first aid is recommended to prevent additional chemical reaction. An e-cigarette blast can induce serious burns and harms that need thorough and lengthy medical treatment particularly when a device goes off in hands, mouths, or pockets. A 2017 review found ""The electrolyte liquid within the lithium ion battery cells is at risk for overheating, thus building pressure that may exceed the capacity of the battery casing. This ""thermal runway"" can ultimately result in cell rupture or combustion."" Metal objects, including coins or keys, can cause a short circuit when kept with batteries, which can result in overheating of the battery. It is recommended to use insulated protective cases for batteries not in use to lessen the potential risk related to thermal runaway. Swallowing e-cigarette batteries can be toxic.
The numbers of medical reports from harms resulting from vaping have continued to increase since 2016. Some batteries are not well designed, are made with poor quality components, or have defects. Major injuries have occurred from battery explosions and fires. Fires caused by e-cigarettes appear to be increasingly frequent. Direct harms from an e-cigarette blast include hand harms, face harms, waist/groin harms, and inhalation harms. Indirect harms happened when the vaporing device set on fire another object and resulted in a house fire, followed by harm from fire burns or inhalation. E-cigarette explosions have resulted in burns, lost teeth, neck fractures, and battery acid contact to the face, mouth, and eyes. The extent of the burns varied from 1% to 8% total body surface area, were reported and most commonly occurred in the lower extremity, hands, head and neck, and genitalia. The extent of the burn was mainly deep partial and full thickness. E-cigarette explosion harms correlated with malfunctioning of the device can result in minor total body surface area 2nd and 3rd degree burns. Around 50% needed surgical management for the burn. This was due to the extent of the injury. The most common harms are burns as a result of explosion in the pocket and harms to the face. A 2017 review found ""Several of the reported cases show that 'the battery in pocket' precedes the incident. The damp environment in the pocket may have sufficient moisture to start a chemical reaction within the lithium-ion battery and the presence of metal objects can produce short-circuit which can over heat the battery leading to an explosion."" Flame burns, chemical burns, and blast injuries have occurred as a result of the e-cigarette battery overheating. A man endured a unilateral corneoscleral laceration with prolapsed iris tissue and hyphemato to the eye area when an e-cigarette exploded in his mouth. A young man endured bilateral corneal burns to the eye area when an e-cigarette exploded near his chest. A man lost his life when his charging e-cigarette blew up and caught on fire next to oxygen equipment. House and car fires and skin burns have resulted from some of the explosions. The explosions were the result of extended charging, use of unsuitable chargers, or design flaws. There is a possible risk to bystanders from e-cigarette explosions. The"	407025.0	train-0-407025.png	407025
en	https://en.wikipedia.org/wiki/Tiilerilaaq	https://upload.wikimedia.org/wikipedia/commons/1/17/Tiniteqilaaq-population-dynamics.png	Tiilerilaaq	Population	Tiilerilaaq / Population	Tiilerilaaq population growth dynamics in the last two decades. Source: Statistics Greenland[4]	Population growth dynamics in Tiniteqilaaq, Greenland. Numbers from 1991-2010 from Statistics Greenland. (http://bank2.stat.gl/) The graph is own work.	Tiilerilaaq population dynamics	image/png	250	1000	False	True	True	Tiilerilaaq is a settlement in the Sermersooq municipality, in southeastern Greenland. Its population was 96 in 2020.	The population of Tiilerilaaq has decreased by 30 percent relative to the 1990 levels, and by 8 percent relative to the 2000 levels, reflecting the depopulation of the nearby Kuummiit and Isortoq.	448110.0	train-0-448110.png	448110
en	https://en.wikipedia.org/wiki/Elections_in_Croatia	https://upload.wikimedia.org/wikipedia/commons/a/af/Croatian_Sabor_Seats-1992-2016.png	Elections in Croatia	Previous parliamentary elections	Elections in Croatia / Parliamentary elections / Previous parliamentary elections	Croatian parliamentary election results, 1992–2016; parties winning 10 or more seats in any one election shown individually	English: Croatian Sabor Seats - 1992-2016	Graph of Croatian election results, using differently-colored lines	image/png	328	571	False	True	True	"Regular elections in Croatia are mandated by the Constitution and legislation enacted by Parliament. The presidency, Parliament, county prefects and assemblies, city and town mayors, and city and municipal councils are all elective offices. Since 1990, five presidential elections have been held. During the same period, nine parliamentary elections were also held. In addition, there were six nationwide local elections. Croatia has held two elections to elect 11 members of the European Parliament following its accession to the EU on 1 July 2013.
The President of Croatia is elected for a five-year term by a direct vote of all citizens in a majority system, requiring runoff elections if no candidate wins more than 50 percent of votes in the first round. Members of Parliament are elected for a four-year term in ten multi-seat constituencies, with additional members elected in special constituencies reserved for the Croatian diaspora and national minorities. As of November 2011, legislation provides for the election of 151 members of the unicameral parliament."	"Since 1990, nine parliamentary elections have been held in Croatia. These have included the 1990 elections for a tricameral parliament, three elections of the Chamber of Deputies during the bicameral parliament's existence, three elections of the unicameral Parliament and two elections of the Chamber of Counties—the upper house of the bicameral parliament.
The elections held in 1990 were the first multi-party elections after 45 years of Communist rule; candidates vied for all 80 seats in the Social-Political Council of Croatia, all 116 seats in the Municipalities Council of Croatia and all 160 seats in the Associated Labour Council of Croatia (since Parliament had three chambers at the time). The first round of the election saw a turnout of 85.5 percent, and the runoff-election turnout was 74.8 percent. The Croatian Democratic Union (HDZ) won 205 seats, and the Social Democratic Party of Croatia won 107."	472392.0	train-0-472392.png	472392
en	https://en.wikipedia.org/wiki/Green_marketing	https://upload.wikimedia.org/wikipedia/commons/9/99/NMI_pie_chart.png	Green marketing	LOHAS	Green marketing / Adoptability / LOHAS	The distribution of the different types of LOHAS.[26]	English: LOHAS Consumer segmentation model 2007	The distribution of the different types of LOHAS.	image/png	496	851	False	True	False	"Green marketing is the marketing of products that are presumed to be environmentally safe. It incorporates a broad range of activities, including product modification, changes to the production process, sustainable packaging, as well as modifying advertising. Yet defining green marketing is not a simple task where several meanings intersect and contradict each other; an example of this will be the existence of varying social, environmental and retail definitions attached to this term. Other similar terms used are environmental marketing and ecological marketing.
Green, environmental and eco-marketing are part of the new marketing approaches which do not just refocus, adjust or enhance existing marketing thinking and practice, but seek to challenge those approaches and provide a substantially different perspective. In more detail green, environmental and eco-marketing belong to the group of approaches which seek to address the lack of fit between marketing as it is currently practiced and the ecological and social realities of the wider marketing environment.
The legal implications of marketing claims call for caution or overstated claims can lead to regulatory or civil challenges."	"LOHAS stands for Lifestyles of Health and Sustainability, and describes an integrated, rapidly growing market for goods and services that appeal to consumers whose sense of environmental and social responsibility influences their purchase decisions. The Natural Marketing Institute's  (short: NMI) estimates the US LOHAS consumer market of products and services to be US$209 billion – sold across all consumer segments.
The five LOHAS segments as defined by NMI include:
 LOHAS: Active environmental stewards dedicated to personal and planetary health. These are the heaviest purchasers of green and socially responsible products and the early adopters who influence others heavily.
 Naturalites: Motivated primarily by personal health considerations. They tend to purchase more LOHAS consumable products vs. durable items.
 Drifters: While their intentions may be good, DRIFTERS follow trends when it is easy and affordable. They are currently quite engaged in green purchasing behaviours.
 Conventionals: Pragmatists who embrace LOHAS behaviour when they believe they can make a difference, but are primarily focused on being very careful with their resources and doing the ‘right’ thing because it will save them money.
 Unconcerned: Either unaware or unconcerned about the environment and societal issues mainly because they do not have the time or the means – these consumers are largely focused on getting by."	480642.0	train-0-480642.png	480642
en	https://en.wikipedia.org/wiki/Tetration	https://upload.wikimedia.org/wikipedia/commons/e/ea/Cube_super_root.png	Tetration	Other super-roots	Tetration / Inverse operations / Super-root / Other super-roots	"The graph
  
    
      
        y
        =
        
          
            
              x
              
                3
              
            
          
          
            s
          
        
      
    
    {\displaystyle y={\sqrt[{3}]{x}}_{s}}
  
."	English: A graph of the cube super root of x, from x=0 to x=6.	A line graph that starts at the origin and quickly makes an asymptote toward 2 as the value along the x-axis increases	image/png	800	1200	False	True	True	"In mathematics, tetration is an operation based on iterated, or repeated, exponentiation. It is the next hyperoperation after exponentiation, but before pentation. The word was coined by Reuben Louis Goodstein from tetra- and iteration.
Under the definition as repeated exponentiation, the notation means, where n copies of a are iterated via exponentiation, right-to-left, I.e. the application of exponentiation times. n is called the ""height"" of the function, while a is called the ""base,"" analogous to exponentiation. It would be read as ""the nth tetration of a"".
Tetration is also defined recursively as
,
allowing for attempts to extend tetration to non-natural numbers such as real and complex numbers.
The two inverses of tetration are called the super-root and the super-logarithm, analogous to the nth root and the logarithmic functions. None of the three functions are elementary.
Tetration is used for the notation of very large numbers."	"For each integer n > 2, the function ⁿx is defined and increasing for x ≥ 1, and ⁿ1 = 1, so that the nth super-root of x, , exists for x ≥ 1.
However, if the linear approximation above is used, then  if −1 < y ≤ 0, so  cannot exist.
In the same way as the square super-root, terminology for other super roots can be based on the normal roots: ""cube super-roots"" can be expressed as ; the ""4th super-root"" can be expressed as ; and the ""nth super-root"" is . Note that  may not be uniquely defined, because there may be more than one nᵗʰ root. For example, x has a single (real) super-root if n is odd, and up to two if n is even.
Just as with the extension of tetration to infinite heights, the super-root can be extended to n = ∞, being well-defined if 1/e ≤ x ≤ e. Note that  and thus that . Therefore, when it is well defined,  and, unlike normal tetration, is an elementary function. For example, .
It follows from the Gelfond–Schneider theorem that super-root  for any positive integer n is either integer or transcendental, and  is either integer or irrational. It is still an open question whether irrational super-roots are transcendental in the latter case."	28614.0	train-0-28614.png	28614
