language	page_url	image_url	page_title	section_title	hierarchical_section_title	caption_reference_description	caption_attribution_description	caption_alt_text_description	mime_type	original_height	original_width	is_main_image	attribution_passes_lang_id	page_changed_recently	context_page_description	context_section_description	index	image_path	Index
en	https://en.wikipedia.org/wiki/Federal_political_financing_in_Canada	http://upload.wikimedia.org/wikipedia/commons/1/11/Party-level_fundraising_costs_vs._party-level_contributions_raised_at_top_3_Canadian_federal_parties_in_2009_sm.png	Federal political financing in Canada	Cost of fundraising	Federal political financing in Canada / Private funding / Cost of fundraising	Party-level fundraising costs vs. party-level contributions raised at top three Canadian federal parties in 2009 (source: Elections Canada[4])	English: Party-level fundraising costs vs. party-level contributions raised at top 3 Canadian federal parties in 2009	Party-level fundraising costs vs. party-level contributions raised at top three Canadian federal parties in 2009	image/png	467	673	False	True	True	The financing of federal political entities in Canada is regulated under the Canada Elections Act. A combination of public and private funds finances the activities of these entities during and outside of elections.	"In order to solicit political monetary contributions, fundraising is a major focus for many parties that involves hiring fundraising experts, and employing sophisticated database systems, email lists, newsletters, and telemarketing.
The Conservative Party, for example, is reported to make phone calls or send letters to about 200,000 people a month, and conducts surveys to collect and feed information on the views of individuals into its database referred to as CIMS, an acronym for ""Constituent Information Management System"". The information stored in the database is then used to customize mailings and phone calls for each targeted donor to appeal to them specifically on issues that they are known to react more strongly to.
Other associated overhead for fundraising include legal consultation, processing, accounting, auditing, and reporting costs.
(Sources: Elections Canada, Globe and Mail)
In 2009, the overhead cost of fundraising for the top three parties exceeded the net private funds they raised. They spent a combined $11.2 million on fundraising at the party level (riding-level expenses not included), according to their 2009 annual party returns, to raise approximately $10.3 million in net private funds."	14152.0	train-0-14152.png	14152
en	https://en.wikipedia.org/wiki/Ernie_Toshack_with_the_Australian_cricket_team_in_England_in_1948	https://upload.wikimedia.org/wikipedia/commons/e/e5/Ernie_Toshack_graph_1948.png	Ernie Toshack with the Australian cricket team in England in 1948	Role	Ernie Toshack with the Australian cricket team in England in 1948 / Role	A chart showing Toshack's batting performance during the tour. The runs scored per innings are represented by the bars, with the red bars being Test innings and the pink bars being other first-class innings. The blue line is the average of the five most recent innings and the dots indicate not outs.[10]	English: FC batting chart for en:Ernie Toshack during the 1948 tour of England. Blue line is an average for five most recent innings, blue dots are not outs. Bars are runs scored. Pink for FC, red for Tests	Toshack started the season with five first-class innings outside the Tests, and all were less than 10 and four were less than five, none were not out. He then scored two scores between 15 and 20 in the Tests, with a score of four outside the Tests in between. After scores of 1 and zero not out in the next two tour matches, he scored 12 not out in his third and final Test innings. He then finished with two in a tour match. All of his efforts beyond ten were in Tests, and he passed ten in all three Test innings, two of these being not out.	image/png	281	553	False	True	True	"Ernie Toshack was a member of Donald Bradman's famous Australian cricket team, which toured England in 1948 and was undefeated in their 34 matches. This unprecedented feat by a Test side touring England earned Bradman's men the sobriquet The Invincibles.
A left-arm medium-pace seam bowler, Toshack was a member of the first-choice team, and played in the first four Test matches before succumbing to a persistent knee injury. Toshack contained the English batsmen with leg theory in between the new ball bursts of Keith Miller and Ray Lindwall. He took 11 wickets in the Tests; his most notable performance was the 5/40 he took in the second innings of the Second Test at Lord's. However, his knee failed in the first innings of the Fourth Test when he took 1/112. He was unable to bowl in the second innings and missed the Fifth Test, marking the end of his Test career.
For the entire tour, Toshack took 50 first-class wickets at a bowling average of 21.12 with four five-wicket innings hauls, including a best of 7/81 against Yorkshire at Bramall Lane."	"A left-arm medium-pace seamer, Toshack was a member of Bradman's first-choice team and he played in the first four Tests before being struck down by a persistent knee injury. Toshack contained the English batsmen using leg theory in between the new ball bursts of Miller and Lindwall, usually bowling second change after Miller, Lindwall and Johnston. The English press decried Toshack's style of bowling as negative, but Jack Fingleton said that ""he is generally so close to the stumps that nearly every ball has to be played"".
During the Tests, Toshack took 11 wickets at 33.09; his most notable performance was his 5/40 in the second innings of the Second Test at Lord's. Of the four frontline pacemen, Toshack had the second best economy rate, although with his leg stump bowling, he also had a strike rate of 94.45, while the other three fast bowlers all had strike rates below 70. It was a similar tale in the first-class statistics, with the second best economy among the seven frontline bowlers, but the worst strike rate. For the entire tour, Toshack took 50 wickets at 21.12 with four five-wicket innings hauls, including a best of 7/81 against Yorkshire at Bramall Lane. He also took 6/51 in the first innings of the match against the Marylebone Cricket Club, which was almost entirely represented by English Test cricketers. Toshack took two catches on tour, none of them in the Tests.
An inept batsman with an average of 5.78 in his first-class career, Toshack managed a Test average of 51.00 on the 1948 tour after being dismissed only once, behind only Arthur Morris, Sid Barnes, Bradman and Neil Harvey. The unbeaten 20 he managed in the Lord's Test was his best first-class score, made in a freewheeling tenth-wicket stand with Johnston.
During the tour, Toshack had few opportunities with the bat, invariably being placed at either No. 10 and No. 11 in the order alongside Johnston, another tailender with little batting ability.ᴺ⁻ Neither player ever passed 30 in their career, and they were the only two players who failed to make a half-century during the tour. As Australia's other specialist bowlers were Lindwall, McCool, Johnson and Doug Ring, all of whom made centuries and more than 18 fifties each during their first-class career, Toshack and Johnston were invariably rooted at the bottom of the order.  As Australia often won by an innings, and declared in the first innings many times due to their batting strength, Toshack only had 12 innings in his 15 first-class fixtures, never batted in the second innings, and scored 78 runs at 8.66. Of the 78 runs, 51 came from four Test innings in Toshack's four Tests.
Due to the fragility of his knee, Toshack was used sparingly in the tour games, playing in only 11 of the 29 non-Test matches on the tour, the least of any player. Toshack was unable to play in the last nine matches of the tour, having injured himself in the second match against Lancashire."	24640.0	train-0-24640.png	24640
en	https://en.wikipedia.org/wiki/Anatomy_of_an_Epidemic	http://upload.wikimedia.org/wikipedia/commons/4/47/SSDI-SSI-1987-2003.png	Anatomy of an Epidemic	Magic bullets	Anatomy of an Epidemic / Synopsis / Magic bullets	Number of Americans who received SSDI and SSI for mental disability in 1987 (blue) when Eli Lilly and Company introduced the antidepressive drug Prozac, compared to 2003 (red).	English: Number of Americans who received U.S. w:Social Security Disability Insurance and U.S. w:Supplemental Security Income for mental disabilties, 1987 to 2003	Chart showing increase (in red) over baseline (in blue) between 1987 and 2003	image/png	446	531	False	True	True	"Anatomy of an Epidemic: Magic Bullets, Psychiatric Drugs, and the Astonishing Rise of Mental Illness in America is a book by Robert Whitaker published in 2010 by Crown. Whitaker asks why the number of Americans who receive government disability for mental illness approximately doubled since 1987.
In the book, Whitaker tries to answer that question and examines the long-term outcomes for the mentally ill in the U.S."	"Whitaker begins by reviewing the discovery of antipsychotics, benzodiazepines and antidepressants.  These were discovered as side effects during research for antihistamines (specifically promethazine), gram negative antibiotics (specifically mephenesin) and the anti-tuberculosis agents isoniazid and iproniazid respectively. The psychiatric mechanisms of action of these drugs were not known at the time and these were initially called major tranquilizers (now typical antipsychotics) due to their induction of ""euphoric quietude""; minor tranquilizers (now benzodiazepines) and psychic energizers (now antidepressants) due to patients ""dancing in the wards."" These compounds were developed during a period of growth for the pharmaceutical industry bolstered by the 1951 Durham-Humphrey Amendment, giving physicians monopolistic prescribing rights thus aligning the interests of physicians and pharmaceutical companies. This also followed the industry's development of ""magic bullets"" that treat people with, for example, diabetes, which according to Whitaker provided an analogy to sell the idea of these drugs to the public. It was not until many years later, after the mechanisms of these drugs were determined, that the serotonergic hypothesis of depression and dopaminergic hypothesis of schizophrenia were developed to fall in line with the drug's mechanisms. According to Whitaker's analysis of the primary literature, lower levels of serotonin and higher levels of dopamine ""have proved to be true in patients WITH prior exposure to antidepressants or antipsychotics (ie as homeostatic mechanisms) but NOT in patients without prior exposure.""
Whitaker further criticizes the magic bullet theory by attacking the historical notion that the ""invention of the antipsychotic Thorazine"" emptied the asylums. His case begins by showing that during the late 1940s and 1950s ~75% of cases admitted for first episode schizophrenia recovered to the community by approximately 3 years (Thorazine was not released until 1955). He then notes that the arrival of Thorazine did not improve discharge rates in the 1950s for people newly diagnosed with schizophrenia. In fact, based on the only large scale first episode schizophrenia study of this era, 88% of those who were not treated were discharged within eighteen months compared to 74% of neuroleptic treated. This is additionally evidenced by the fact that when Thorazine was introduced in 1955 there were 267 thousand schizophrenia patients in state and county mental hospitals, and eight years later, there were 253 thousand, thus indicating that the advent of neuroleptics barely budged the number of hospitalized patients. What he argues actually cleared the asylums was the beginning of Medicare and Medicaid in 1965. These programs provided federal subsidies for nursing home care but no such subsidy for care in state mental hospitals, and so the states, seeking to save money, began shipping their chronic patients to nursing homes."	29695.0	train-0-29695.png	29695
en	https://en.wikipedia.org/wiki/Nutaarmiut	https://upload.wikimedia.org/wikipedia/commons/3/31/Nutaarmiut-population-dynamics.png	Nutaarmiut	Population	Nutaarmiut / Population	Nutaarmiut population growth dynamics in the last two decades. Source: Statistics Greenland[2]	Population growth dynamics in Nutaarmiut, Greenland. Numbers from 1991-2010 from Statistics Greenland. (http://bank2.stat.gl/) The graph is own work.	Nutaarmiut population dynamics	image/png	250	1000	False	True	True	Nutaarmiut is an island settlement in the Qaasuitsup municipality, in northwestern Greenland. It had 43 inhabitants in 2020.	The population of Nutaarmiut has decreased by over a 40 percent relative to the 1990 levels, and has been steadily decreasing in the 2000s.	42178.0	train-0-42178.png	42178
en	https://en.wikipedia.org/wiki/Bootham_Crescent	https://upload.wikimedia.org/wikipedia/commons/0/08/Bootham_Crescent_league_attendances.png	Bootham Crescent	Records	Bootham Crescent / Records	York City's highest and average league attendances at Bootham Crescent from the 1932–33 season	"English: A graph of York City F.C.'s league attendances at Bootham Crescent, York from 1932 Highest attendances for the 1932–33 to 2007–08 seasons: Batters, David (2008) York City: The Complete Record, Derby: Breedon Books, pp.&#160;258–410 ISBN: 978-1-85983-633-0. Highest attendance for the 2008–09 season: (2009) Non-League Club Directory 2010, Tony Williams Publications, p.&#160;162 ISBN: 9-781869-833664. Highest attendance for the 2009–10 season: (2010) Non-League Club Directory 2011, Tony Williams Publications, p.&#160;160 ISBN: 9-781869-833688. Highest attendance for the 2010–11 season: (2011) Non-League Club Directory 2012, Tony Williams Publications, p.&#160;156 ISBN: 9-781869-833701. Highest attendance for the 2011–12 season: (2012) Non-League Club Directory 2013, Tony Williams Publications, p.&#160;162 ISBN: 9-781869-833770. Highest attendances for the 2012–13 to 2015–16 seasons: Statistics: English League Two: 2012/2013. ESPN FC. Retrieved on 23 August 2016. Individual seasons accessed via dropdown menu. Average attendances for the 1932–33 to 2007–08 seasons: Batters York City: The Complete Record, pp.&#160;235–237 Average attendance for the 2008–09 season: York City FC. European Football Statistics. Retrieved on 23 August 2016. Average attendance for the 2009–10 season: Flett, Dave (20 May 2010). ""Review of York City's 2009/10 season"". The Press. Retrieved on 23 August 2016. Average attendances for the 2010–11 to 2011–12 seasons: York City FC. European Football Statistics. Retrieved on 23 August 2016. Average attendance for the 2012–13 season: Statistics: English League Two: 2012/2013. ESPN FC. Retrieved on 18 August 2015. Average attendance for the 2013–14 season: Football League statistics. The Football League. Archived from the original on 31 May 2014. Average attendances for the 2014–15 to 2015–16 seasons: Statistics: English League Two: 2014/2015. ESPN FC. Retrieved on 23 August 2016. Individual seasons accessed via dropdown menu."	Graph showing the highest and average league attendances at the Bootham Crescent association football ground	image/png	733	1133	False	True	True	"Bootham Crescent in York, North Yorkshire, England, is the home of York City football club and York City Knights rugby league club. With a capacity of 8,256, it is near the city centre, just over a mile from York railway station.
York City leased land at Bootham Crescent from York Cricket Club as a replacement for their ground at Fulfordgate on the outskirts of the city. The ground was constructed in four months, and opened on 31 August 1932. In the Second World War, the Popular Stand was converted into an air-raid shelter, and the ground suffered slight damage when a bomb landed on houses along the Shipton Street End. York purchased Bootham Crescent for £4,075 in 1948. Floodlights were fitted at the ground in 1959, and replaced by ones twice as powerful in 1995. A number of improvements were made in the early 1980s, with a gymnasium, offices and a lounge for officials built.
The David Longhurst Stand opened in 1991 after a roof was erected on the Shipton Street End, named after the former York player David Longhurst who died during a match at the ground in 1990."	"The highest attendance record at the ground was 28,123 for a match against Huddersfield Town in the FA Cup sixth round on 5 March 1938. The highest attendance in the Football League is 21,010 against Hull City in the Third Division North on 23 April 1949. The attendance of 1,167 against Northampton Town on 5 May 1981 is the lowest ever to see York in a Football League match. York were relegated to the Conference National in 2004, and their highest home attendance in this division was 6,660 for a match against Morecambe on 4 May 2007. The lowest was 1,567 for a match against Exeter City on 10 March 2008. The lowest attendance at the ground for any first-team fixture was 608 for a Conference League Cup third-round match against Mansfield Town on 4 November 2008.
The highest seasonal average attendance for York at Bootham Crescent was 10,412 in 1948–49. York's lowest seasonal average was 2,139 in 1977–78, which came after two successive relegations from the Second Division. The most recent season in which the average attendance was more than 10,000 was in 1955–56. This season also saw York's highest total seasonal attendance at the ground, which was 236,685. The lowest total seasonal attendance was 48,357 for 1977–78 in the Fourth Division.
York's biggest margin of victory at Bootham Crescent was by eight goals, achieved with a 9–1 win over Southport in the Third Division North on 2 February 1957. Their biggest margin of defeat at the ground was by seven goals, when they were beaten 7–0 by Rochdale in a Third Division North match on 14 January 1939. The most goals scored in a match was 12 on 16 November 1935, when York defeated Mansfield Town 7–5 in the Third Division North."	62319.0	train-0-62319.png	62319
en	https://en.wikipedia.org/wiki/History_of_Georgetown_University	https://upload.wikimedia.org/wikipedia/commons/4/47/Georgetown_University_enrollment_1791-1888.png	History of Georgetown University	Early student life	History of Georgetown University / Early growth / Early student life	Graph of student enrollment 1791—1888	English: Graph of the first century of Georgetown University student enrollment, between the Academy and College, the Medical Department, and the Law Department. The Medical Department was later renamed the School of Medicine and the Law Department is currently Georgetown University Law Center. Made with Microsoft Excel. Data from Curran, Robert Emmett (1993). The Bicentennial History of Georgetown University. Georgetown University Press. ISBN 0-8784-0485-6. &#160;&#160; Academy &amp; College &#160;&#160; Medical School &#160;&#160; Law School	A line graph of years from 1791 to 1888 with three subjects, the first in blue representing the Academy and College rises up from 69 in 1791 to 333 at its peak in 1857 followed by sudden drop and leveling around 200. The second, in red, represents the Medical School and begins in 1851 quickly peaking at 127 and then falling again while the third, in yellow, represents the law school which begins in 1871 and steadily rises to 168.	image/png	907	1403	False	True	False	"The history of Georgetown University spans nearly four hundred years, from the early European settlement of America to the present day. Georgetown University has grown with both its city, Washington, D.C., and the United States, each of which date their founding to the period from 1788 to 1790. Georgetown's origins are in the establishment of the Maryland colony in the seventeenth-century. Bishop John Carroll established the school at its present location by the Potomac River after the American Revolution allowed for free religious practice.
The role of the Society of Jesus in the school's operation has evolved from that of founders and financiers to faculty and advisers. Their focus on liberal studies and religious pluralism have helped to give the school its identity. Georgetown was also affected by its times, including the American Civil War, which disrupted the growing school and significantly changed its student body. University presidents like Patrick Francis Healy modernized the institution into an active research university with several graduate and undergraduate schools, and oversaw the expansion of educational opportunities on campus, around the city, and abroad."	"From its beginning, Georgetown was not intended to be exclusively Catholic, and over its first ten years, nearly one-fifth of students were Protestant. A fifth of students were also from the Caribbean. By 1830, Jewish students were known to be attending. European immigrants and Napoleonic War refugees also made up significant parts of the early student body. School rules were harshly enforced. Leonard Neale, a strict moralist, regulated students' movements such that founder John Carrol accused him of running Georgetown ""on the principles of a convent."" There were three student organized rebellions against the Georgetown administration in the antebellum period. The most notable of these occurred in January 1850, against the administration of James A. Ryder over the school food. Students damaged the dormitories and took charge of a local hotel.
The first student society, the Sodality of Our Lady, was founded in 1810 as a religious devotional group. A strict revision of school rules in 1829 forbade personal conversations or particular associations. Despite this the Philodemic Society was founded in 1830 as the school's debating and literary society, the oldest of its kind in America and the oldest secular group at Georgetown. Other debating societies were founded in its model, or in opposition to it in later years, such as the short lived Philisorian Society and the Philonomosian Society, which lasted from 1839 until 1935. The College Cadets were officially organized in 1836, becoming the oldest military unit native to the District of Columbia. The Dramatic Association of Georgetown College, renamed the Mask and Bauble Dramatic Society after World War I, was founded in 1852, and is itself the oldest surviving student dramatic society in America. The first Christmas tree was introduced to campus in December 1857."	75149.0	train-0-75149.png	75149
